{
  "schema_version": "storyboard-qa/1.0",
  "status": "VALID",
  "structure": "PASS",
  "diagnostics": [],
  "media": "NOT_RUN",
  "visual": "NOT_RUN",
  "execution_ready": false,
  "submitted": false,
  "contract_results": [],
  "manual_checks": [
    "原文事件、潜台词与观众知情顺序：对照原文及导演决定逐镜审阅。",
    "三维碰撞、摄影投影、遮挡、视线和手部接触：检查预演或真实画格。",
    "表情幅度、重心、动作惯性、接动作剪点：查看连续媒体，不能只看首尾帧。",
    "身份、服化道、场景拓扑、光源和道具：逐镜核对实际参考及资产版本。",
    "台词声音归属、口型、停顿、旁白与音乐混音：实听实看并标时间码。",
    "执行入口、模型版本、模式、附件、时长和返回素材：由宿主核验并另存真实回执。"
  ]
}
